title,time,clean_title
Apple brings encrypted RCS chats to iPhone,2026-05-11 17:57:56+00:00,apple brings encrypted rcs chats to iphone
The Apple Studio Display could have been so much more,2026-05-13 03:20:23+00:00,the apple studio display could have been so much more
Tim Cook’s departure is the start of a new era at Apple,2026-04-22 22:05:10+00:00,tim cooks departure is the start of a new era at apple
Apple agrees to pay iPhone owners $250 million for not delivering AI Siri,2026-05-05 21:19:26+00:00,apple agrees to pay iphone owners  million for not delivering ai siri
Will a new CEO realize Apple’s smart home potential?,2026-04-22 15:32:28+00:00,will a new ceo realize apples smart home potential
Apple’s $599 MacBook Neo could be at risk from rising RAM prices,2026-05-07 15:05:37+00:00,apples  macbook neo could be at risk from rising ram prices
Apple Will Pay $250 Million to Settle Lawsuit Over Siri's AI Features,2026-05-06 10:41:37+00:00,apple will pay  million to settle lawsuit over siris ai features
The Weirdest Wearables From 100 Years Ago,2026-05-06 12:00:08+00:00,the weirdest wearables from  years ago
iFixit Is Ranking Wireless Headphones Now and It Just Crowned a Repairable King,2026-05-07 20:15:29+00:00,ifixit is ranking wireless headphones now and it just crowned a repairable king
"Homebridge 2.0 is here, and it speaks Matter",2026-05-04 12:35:06+00:00,homebridge  is here and it speaks matter
Apple TV’s new horror series is scarier because it’s also hilarious,2026-04-28 17:00:13+00:00,apple tvs new horror series is scarier because its also hilarious
"Someone Shoved Cameras Into Sony Earbuds, and Now They’re Basically Smart Glasses",2026-05-18 15:44:58+00:00,someone shoved cameras into sony earbuds and now theyre basically smart glasses
This Year’s Apple Watch Might Play Things Very Safe,2026-05-11 14:45:36+00:00,this years apple watch might play things very safe
"Under Ternus, Apple Is Reportedly Entering a Spendy New Era",2026-05-03 17:58:11+00:00,under ternus apple is reportedly entering a spendy new era
OpenAI Falls Behind and Looks to Blame Apple,2026-05-14 20:55:34+00:00,openai falls behind and looks to blame apple
"Google’s Next Phone Chip Will Be Faster, and Still Not Fast Enough",2026-05-11 15:30:03+00:00,googles next phone chip will be faster and still not fast enough
"Apple’s Privacy Standards May Be Eroding as New Siri Features Roll Out, Report Says",2026-05-18 09:30:49+00:00,apples privacy standards may be eroding as new siri features roll out report says
‘Widow’s Bay’ Reveals the Perils of Dating on a Cursed Island,2026-05-06 18:00:24+00:00,widows bay reveals the perils of dating on a cursed island
‘Pluribus’ Creator Vince Gilligan Hopes You Feel Some Ambiguity About Its Post-Apocalypse,2026-05-18 21:00:17+00:00,pluribus creator vince gilligan hopes you feel some ambiguity about its postapocalypse
Your guide to sci-fi streaming season,2026-05-01 12:25:59+00:00,your guide to scifi streaming season
You Should Check Out the Other ‘Severance’,2026-05-07 19:00:44+00:00,you should check out the other severance
The ‘For All Mankind’ Spin-Off’s New Trailer Is Dripping With Cold War Paranoia,2026-04-23 14:00:20+00:00,the for all mankind spinoffs new trailer is dripping with cold war paranoia
"Please, Carol, Stop What You’re Doing and Watch This ‘Pluribus’ Bonus Scene",2026-05-13 12:00:35+00:00,please carol stop what youre doing and watch this pluribus bonus scene
Apple’s accessibility features add more AI-powered processing,2026-05-19 14:58:12+00:00,apples accessibility features add more aipowered processing
AirPods With Cameras Won’t Let You Be a Total Creep,2026-05-08 14:00:01+00:00,airpods with cameras wont let you be a total creep
Apple’s New iOS Update Finally Throws a Bone to the Android Green Bubbles,2026-05-11 19:09:49+00:00,apples new ios update finally throws a bone to the android green bubbles
The Beats Solo 4 have returned to their best price of the year,2026-05-14 15:13:14+00:00,the beats solo  have returned to their best price of the year
Microsoft says the ‘idea’ of an Xbox mobile store ‘is not dead’,2026-04-22 16:28:20+00:00,microsoft says the idea of an xbox mobile store is not dead
Ugreen’s new soccer ball-shaped tracker has up to 7 years of battery life,2026-05-19 19:49:11+00:00,ugreens new soccer ballshaped tracker has up to  years of battery life
"Yes, Apple Is Reportedly Retooling Some Liquid Glass Problems for macOS 27",2026-05-11 09:00:51+00:00,yes apple is reportedly retooling some liquid glass problems for macos 
"After working on the Vision Pro, this AR veteran is going back to phones",2026-04-30 12:04:11+00:00,after working on the vision pro this ar veteran is going back to phones
The Latest Apple Smart Glasses Rumor Sounds Like a Long Shot,2026-05-01 15:20:01+00:00,the latest apple smart glasses rumor sounds like a long shot
"Apple Adds Apple Watch to Education Store in Australia, China, Japan, and More",2026-05-07 15:14:22+00:00,apple adds apple watch to education store in australia china japan and more
Apple Weather App Experiencing Outage,2026-04-28 18:00:35+00:00,apple weather app experiencing outage
iOS 27 might add a lot more customization to the Camera app,2026-05-12 21:36:11+00:00,ios  might add a lot more customization to the camera app
watchOS 26.5 Fixes Two Apple Watch Bugs,2026-05-05 14:56:33+00:00,watchos  fixes two apple watch bugs
Elon Musk and Sam Altman’s court battle over the future of OpenAI,2026-04-27 15:51:41+00:00,elon musk and sam altmans court battle over the future of openai
Apple Manufacturing Academy Hosts AI Showcase,2026-05-05 13:27:14+00:00,apple manufacturing academy hosts ai showcase
"Apple Card Holders Can Now Get Free AirPods Pro 3, But There's a Catch",2026-05-18 15:11:52+00:00,apple card holders can now get free airpods pro  but theres a catch
It’s time to let my iPhone Mini go,2026-05-05 23:53:08+00:00,its time to let my iphone mini go
Apple Card Promo to Offer Free AirPods Pro 3,2026-05-15 15:59:21+00:00,apple card promo to offer free airpods pro 
"Next Apple Watch Models Unlikely to Add Touch ID, Focus on Battery Life",2026-05-11 10:41:24+00:00,next apple watch models unlikely to add touch id focus on battery life
Google Confirms Gemini-Powered Siri Coming Later This Year,2026-04-22 18:08:04+00:00,google confirms geminipowered siri coming later this year
"Ads Aren't in the Apple Maps App Yet, But They're Coming Soon",2026-05-13 23:15:42+00:00,ads arent in the apple maps app yet but theyre coming soon
Fortnite Returns to the App Store Worldwide as Epic Signals 'Final Battle' With Apple,2026-05-19 13:08:22+00:00,fortnite returns to the app store worldwide as epic signals final battle with apple
Discover Dropping Two Apple Wallet Features,2026-04-30 20:09:49+00:00,discover dropping two apple wallet features
"Best Apple Deals of the Week: Low Prices on Apple Watch, MacBook Air, AirTag 1, and More",2026-04-24 16:49:58+00:00,best apple deals of the week low prices on apple watch macbook air airtag  and more
"Apple Seeds watchOS 26.5, tvOS 26.5 and visionOS 26.5 Release Candidates",2026-05-04 17:19:29+00:00,apple seeds watchos  tvos  and visionos  release candidates
"Apple, Intel Have Reached Preliminary Chip-Making Agreement",2026-05-08 18:00:00+00:00,apple intel have reached preliminary chipmaking agreement
"Apple Sports App Updated With 2026 World Cup Features, Expands to 90 More Countries",2026-05-19 17:26:03+00:00,apple sports app updated with  world cup features expands to  more countries
Apple Has Given Up on the Vision Pro After M5 Refresh Flop,2026-04-29 18:31:59+00:00,apple has given up on the vision pro after m refresh flop
Apple Alerted to macOS Security Vulnerability Uncovered With AI Tool,2026-05-14 16:04:59+00:00,apple alerted to macos security vulnerability uncovered with ai tool
Apple to Pay $250 Million to Settle Class Action Over Delayed Siri Features,2026-05-05 21:01:20+00:00,apple to pay  million to settle class action over delayed siri features
What to know as Trump visits Xi in China,2026-05-13 13:01:51+00:00,what to know as trump visits xi in china
Apple Sued for Pulling Co-Viewing App Rave From the App Store,2026-05-07 17:41:50+00:00,apple sued for pulling coviewing app rave from the app store
Apple Releases iOS 26.4.2 and iPadOS 26.4.2 With Bug Fixes,2026-04-22 17:23:01+00:00,apple releases ios  and ipados  with bug fixes
Sleep Number ComfortNext Lux Smart Bed: Redefining Support,2026-05-07 12:07:00+00:00,sleep number comfortnext lux smart bed redefining support
Apple Seeds Second iOS 26.5 and iPadOS 26.5 Release Candidates to Developers,2026-05-08 17:16:47+00:00,apple seeds second ios  and ipados  release candidates to developers
"Apple Looking to Samsung and Intel for Chips Amid Shortages, Report Says",2026-05-05 19:45:00+00:00,apple looking to samsung and intel for chips amid shortages report says
Apple TV Has Two Massive Hits Returning This Summer,2026-05-07 12:30:00+00:00,apple tv has two massive hits returning this summer
Vision Pro Creator Mike Rockwell Has Considered Leaving Apple,2026-04-22 13:09:58+00:00,vision pro creator mike rockwell has considered leaving apple
WWDC 2026 is a Month Away: Apple Highlights 'Distinguished Winners',2026-05-07 14:35:06+00:00,wwdc  is a month away apple highlights distinguished winners
Leaker: This Is Why Apple Is Delaying the iPhone 18,2026-05-06 14:56:56+00:00,leaker this is why apple is delaying the iphone 
Samsung Overtakes Apple for Top Smartphone Customer Satisfaction,2026-05-20 15:45:00+00:00,samsung overtakes apple for top smartphone customer satisfaction
Apple Project Files Allegedly Stolen in Foxconn Ransomware Attack,2026-05-13 10:25:29+00:00,apple project files allegedly stolen in foxconn ransomware attack
Are the $599 MacBook Neo's Days Numbered?,2026-05-07 18:17:37+00:00,are the  macbook neos days numbered
Apple Reportedly Plans Major Camera AI Overhaul in iOS 27,2026-04-29 22:57:00+00:00,apple reportedly plans major camera ai overhaul in ios 
Leaker: Apple to Downgrade iPhone 18 in Two Ways,2026-04-22 15:02:54+00:00,leaker apple to downgrade iphone  in two ways
Apple Wins EU Challenge Over Keyboard Maker's Citrus Logo,2026-05-06 18:48:36+00:00,apple wins eu challenge over keyboard makers citrus logo
Apple Seeds iOS 26.5 and iPadOS 26.5 Release Candidates to Developers,2026-05-04 17:12:07+00:00,apple seeds ios  and ipados  release candidates to developers
Apple Eyes Intel and Samsung as Backup US Chipmakers,2026-05-05 09:32:48+00:00,apple eyes intel and samsung as backup us chipmakers
Spotify to Adopt Apple's Technology for Video Podcasts,2026-05-14 16:02:53+00:00,spotify to adopt apples technology for video podcasts
Epic Games Wins Reversal of Stay in App Store Fee Legal Battle,2026-04-29 12:05:50+00:00,epic games wins reversal of stay in app store fee legal battle
Apple's AI Smart Glasses Likely to Support Hand Gesture Controls,2026-04-29 20:23:48+00:00,apples ai smart glasses likely to support hand gesture controls
Ads Are Coming to Apple Maps This Summer: Here's What to Expect,2026-04-24 20:58:00+00:00,ads are coming to apple maps this summer heres what to expect
Delta CEO Details Why He Thinks Amazon Leo Beats Starlink,2026-05-21 14:30:42+00:00,delta ceo details why he thinks amazon leo beats starlink
