title,time,clean_title
Rank the 50 best Apple products,2026-03-27 10:00:00+00:00,rank the  best apple products
Between Jobs,2026-03-30 17:57:09+00:00,between jobs
Apple could put ads in Maps as soon as this summer,2026-03-23 18:54:44+00:00,apple could put ads in maps as soon as this summer
How the Vision Pro Rollout Inflamed Tensions at Apple,2026-04-07 10:00:00+00:00,how the vision pro rollout inflamed tensions at apple
Apple is going high-end with new ‘Ultra’ products next,2026-03-08 17:51:15+00:00,apple is going highend with new ultra products next
Nuki adds Apple Home Key to its smart lock,2026-03-24 13:02:13+00:00,nuki adds apple home key to its smart lock
Apple Studio Display XDR review: pro at a premium,2026-03-09 19:53:45+00:00,apple studio display xdr review pro at a premium
Apple is testing a standalone app for its overhauled Siri,2026-03-24 20:41:24+00:00,apple is testing a standalone app for its overhauled siri
Here’s how to rank the 50 best Apple products ever,2026-03-26 23:31:02+00:00,heres how to rank the  best apple products ever
How the Apple Watch defined modern health tech,2026-04-03 12:52:14+00:00,how the apple watch defined modern health tech
The Apple Watch SE 3 is even easier to recommend at $50 off,2026-03-24 17:18:10+00:00,the apple watch se  is even easier to recommend at  off
"Hermès doesn’t include a power adapter with its $5,150 charging case",2026-03-19 19:08:03+00:00,herms doesnt include a power adapter with its  charging case
The MacBook Neo is a winner,2026-03-13 13:13:16+00:00,the macbook neo is a winner
Apple’s $549 AirPods Max 2 add better ANC and live translation,2026-03-16 13:33:17+00:00,apples  airpods max  add better anc and live translation
Apple’s WWDC 2026 event starts June 8th,2026-03-23 17:21:53+00:00,apples wwdc  event starts june th
Iran Threatens to Start Attacking Major US Tech Firms on April 1,2026-03-31 21:25:12+00:00,iran threatens to start attacking major us tech firms on april 
Apple reduces App Store fees in China to ward off regulators,2026-03-13 11:16:12+00:00,apple reduces app store fees in china to ward off regulators
What's New in the AirPods Max 2? Breaking Down Apple's Headphone Update,2026-03-16 20:14:33+00:00,whats new in the airpods max  breaking down apples headphone update
Apple smart home display rumors now point to a fall launch with iOS 27,2026-03-09 22:26:50+00:00,apple smart home display rumors now point to a fall launch with ios 
Apple Removes iPhone Vibe Coding App from App Store,2026-03-31 09:30:59+00:00,apple removes iphone vibe coding app from app store
Apple’s iOS 26.4 update adds age verification in the UK,2026-03-25 13:54:10+00:00,apples ios  update adds age verification in the uk
Steve Jobs and the greatest run of products in tech history,2026-03-29 17:15:36+00:00,steve jobs and the greatest run of products in tech history
‘Severance’ Star Dichen Lachman Has a New Job: Vampire Slayer,2026-03-20 14:00:41+00:00,severance star dichen lachman has a new job vampire slayer
Why WWDC 2026 Will Be Apple’s Most Important Developer Conference in Years,2026-03-23 18:00:44+00:00,why wwdc  will be apples most important developer conference in years
"Apple’s Delay-Plagued Siri Project Has Also Interfered with Physical Product Releases, Report Says",2026-03-15 17:23:41+00:00,apples delayplagued siri project has also interfered with physical product releases report says
"Apple’s Mac Pro is dead, apparently for good this time",2026-03-26 22:21:05+00:00,apples mac pro is dead apparently for good this time
‘Pluribus’ Might Ignore That Giant Bomb of a Season One Cliffhanger,2026-03-19 12:00:24+00:00,pluribus might ignore that giant bomb of a season one cliffhanger
The Best Gadgets of March 2026,2026-03-31 20:05:23+00:00,the best gadgets of march 
Aqara Smart Lock U400 Review: Hands-free Unlocking at Its Best,2026-03-29 15:00:34+00:00,aqara smart lock u review handsfree unlocking at its best
Apple’s Siri Isn’t Just Going to Use One Chatbot. It’s Going to Use All of Them,2026-03-26 21:40:09+00:00,apples siri isnt just going to use one chatbot its going to use all of them
Apple at 50: Three products that changed how we live - and three that really didn't,2026-04-04 23:56:55+00:00,apple at  three products that changed how we live  and three that really didnt
The Macintosh changed computers forever,2026-03-29 12:30:36+00:00,the macintosh changed computers forever
Apple’s sci-fi thriller Dark Matter is back in August,2026-04-07 13:04:35+00:00,apples scifi thriller dark matter is back in august
"iPhone Fold rumor: iPad-like multitasking, but no iPad apps and no Face ID",2026-03-11 22:22:33+00:00,iphone fold rumor ipadlike multitasking but no ipad apps and no face id
My favorite robot vacuum now supports Matter,2026-03-18 17:30:07+00:00,my favorite robot vacuum now supports matter
The Beats Studio Pro are nearly $200 off ahead of Amazon’s big spring sale,2026-03-17 20:38:08+00:00,the beats studio pro are nearly  off ahead of amazons big spring sale
Apple Requires Device-Level Age Verification in the UK Now. Could the US Be Next?,2026-03-26 19:35:22+00:00,apple requires devicelevel age verification in the uk now could the us be next
‘I Don’t Use AI Much’: Apple Co-Founder Expresses Skepticism AI Can Replace Humans,2026-03-24 09:00:41+00:00,i dont use ai much apple cofounder expresses skepticism ai can replace humans
Anthropic is launching a new AI model for cybersecurity,2026-04-07 16:41:21+00:00,anthropic is launching a new ai model for cybersecurity
Report: Apple Is Testing Features That Will Put Siri All Over Your iPhone Experience,2026-03-25 10:30:55+00:00,report apple is testing features that will put siri all over your iphone experience
Apple App Store Experiences Surge in New Apps Amid Vibe Coding Boom,2026-04-06 10:00:39+00:00,apple app store experiences surge in new apps amid vibe coding boom
"Fitbit’s budget-friendly Inspire 3 is $30 off, matching its best price",2026-03-26 18:41:42+00:00,fitbits budgetfriendly inspire  is  off matching its best price
Apple Announces Ads Are Coming to Apple Maps,2026-03-24 16:22:46+00:00,apple announces ads are coming to apple maps
"This Is Supposedly the Final, Final, FINAL Look of the Foldable iPhone",2026-04-07 14:30:58+00:00,this is supposedly the final final final look of the foldable iphone
Apple Intelligence Accidentally Goes Live in China Before Regulatory Approval,2026-03-30 19:48:12+00:00,apple intelligence accidentally goes live in china before regulatory approval
Apple TV Is Now Almost 20 Years Old,2026-03-21 13:14:04+00:00,apple tv is now almost  years old
Best Laptops (2026): My Honest Advice Having Tested Hundreds,2026-03-23 11:30:00+00:00,best laptops  my honest advice having tested hundreds
Apple’s new M5 Max feels like a huge upgrade if you bought your laptop 3 years ago,2026-03-09 20:02:29+00:00,apples new m max feels like a huge upgrade if you bought your laptop  years ago
"Apple Releases Fourth watchOS 26.4, tvOS 26.4 and visionOS 26.4 Betas",2026-03-09 17:13:30+00:00,apple releases fourth watchos  tvos  and visionos  betas
New Apple Immersive Video of BBC Proms Concert on Apple Vision Pro,2026-03-27 13:05:16+00:00,new apple immersive video of bbc proms concert on apple vision pro
Apple TV Releasing Star-Studded Movie Next Month,2026-03-17 13:40:23+00:00,apple tv releasing starstudded movie next month
Apple Announces WWDC 2026 Will Take Place June 8 to 12,2026-03-23 16:55:57+00:00,apple announces wwdc  will take place june  to 
New Apple TV Waiting for Siri: Here's What's Coming When It Launches,2026-04-03 21:56:47+00:00,new apple tv waiting for siri heres whats coming when it launches
Apple Announces AirPods Max 2,2026-03-16 13:12:44+00:00,apple announces airpods max 
"Apple's 50th: Mumford & Sons in London, Illuminated Artwork in Sydney",2026-03-25 21:27:06+00:00,apples th mumford  sons in london illuminated artwork in sydney
Mexico is Seemingly Getting a Third Apple Store,2026-03-23 20:54:48+00:00,mexico is seemingly getting a third apple store
tvOS 26.4 Adds These New Features to Your Apple TV,2026-03-25 22:33:00+00:00,tvos  adds these new features to your apple tv
Apple Releasing Two New iPhone Apps This Year,2026-03-28 15:00:00+00:00,apple releasing two new iphone apps this year
Apple Turns Off Payments in Russia,2026-04-02 15:47:30+00:00,apple turns off payments in russia
Apple Adds 'Genius Browse' Movie and TV Recommendations to Apple TV in tvOS 26.4,2026-03-18 23:17:12+00:00,apple adds genius browse movie and tv recommendations to apple tv in tvos 
There’s a Good Reason the MacBook Neo Is Apple’s Most Repairable Laptop,2026-03-16 16:10:24+00:00,theres a good reason the macbook neo is apples most repairable laptop
No Major Apple Watch Redesign Expected This Year,2026-03-26 18:12:55+00:00,no major apple watch redesign expected this year
Apple Hoping to 3D-Print More Products,2026-03-08 14:25:43+00:00,apple hoping to dprint more products
Apple Can Create Smaller On-Device AI Models From Google's Gemini,2026-03-25 16:53:40+00:00,apple can create smaller ondevice ai models from googles gemini
Amazon’s best Echo speakers and screens just got their biggest discounts,2026-03-16 15:15:16+00:00,amazons best echo speakers and screens just got their biggest discounts
New Apple TV 4K and HomePod Likely Won't Launch Until New Siri is Ready,2026-03-09 19:43:50+00:00,new apple tv k and homepod likely wont launch until new siri is ready
Satechi’s 3-in-1 travel stand now wirelessly charges your phone at 25W,2026-04-02 22:16:11+00:00,satechis in travel stand now wirelessly charges your phone at w
"Apple Invites App Updated, Here's What's New",2026-03-11 14:49:48+00:00,apple invites app updated heres whats new
Apple Released Seven New Products Today,2026-03-11 14:05:00+00:00,apple released seven new products today
