title,time
Apple brings encrypted RCS chats to iPhone,2026-05-11T17:57:56Z
The Apple Studio Display could have been so much more,2026-05-13T03:20:23Z
Tim Cook’s departure is the start of a new era at Apple,2026-04-22T22:05:10Z
Apple agrees to pay iPhone owners $250 million for not delivering AI Siri,2026-05-05T21:19:26Z
Will a new CEO realize Apple’s smart home potential?,2026-04-22T15:32:28Z
Apple’s $599 MacBook Neo could be at risk from rising RAM prices,2026-05-07T15:05:37Z
Apple Will Pay $250 Million to Settle Lawsuit Over Siri's AI Features,2026-05-06T10:41:37Z
The Weirdest Wearables From 100 Years Ago,2026-05-06T12:00:08Z
iFixit Is Ranking Wireless Headphones Now and It Just Crowned a Repairable King,2026-05-07T20:15:29Z
"Homebridge 2.0 is here, and it speaks Matter",2026-05-04T12:35:06Z
Apple TV’s new horror series is scarier because it’s also hilarious,2026-04-28T17:00:13Z
"Someone Shoved Cameras Into Sony Earbuds, and Now They’re Basically Smart Glasses",2026-05-18T15:44:58Z
This Year’s Apple Watch Might Play Things Very Safe,2026-05-11T14:45:36Z
"Under Ternus, Apple Is Reportedly Entering a Spendy New Era",2026-05-03T17:58:11Z
OpenAI Falls Behind and Looks to Blame Apple,2026-05-14T20:55:34Z
"Google’s Next Phone Chip Will Be Faster, and Still Not Fast Enough",2026-05-11T15:30:03Z
"Apple’s Privacy Standards May Be Eroding as New Siri Features Roll Out, Report Says",2026-05-18T09:30:49Z
‘Widow’s Bay’ Reveals the Perils of Dating on a Cursed Island,2026-05-06T18:00:24Z
‘Pluribus’ Creator Vince Gilligan Hopes You Feel Some Ambiguity About Its Post-Apocalypse,2026-05-18T21:00:17Z
Your guide to sci-fi streaming season,2026-05-01T12:25:59Z
You Should Check Out the Other ‘Severance’,2026-05-07T19:00:44Z
The ‘For All Mankind’ Spin-Off’s New Trailer Is Dripping With Cold War Paranoia,2026-04-23T14:00:20Z
"Please, Carol, Stop What You’re Doing and Watch This ‘Pluribus’ Bonus Scene",2026-05-13T12:00:35Z
Apple’s accessibility features add more AI-powered processing,2026-05-19T14:58:12Z
AirPods With Cameras Won’t Let You Be a Total Creep,2026-05-08T14:00:01Z
Apple’s New iOS Update Finally Throws a Bone to the Android Green Bubbles,2026-05-11T19:09:49Z
The Beats Solo 4 have returned to their best price of the year,2026-05-14T15:13:14Z
Microsoft says the ‘idea’ of an Xbox mobile store ‘is not dead’,2026-04-22T16:28:20Z
Ugreen’s new soccer ball-shaped tracker has up to 7 years of battery life,2026-05-19T19:49:11Z
"Yes, Apple Is Reportedly Retooling Some Liquid Glass Problems for macOS 27",2026-05-11T09:00:51Z
"After working on the Vision Pro, this AR veteran is going back to phones",2026-04-30T12:04:11Z
The Latest Apple Smart Glasses Rumor Sounds Like a Long Shot,2026-05-01T15:20:01Z
"Apple Adds Apple Watch to Education Store in Australia, China, Japan, and More",2026-05-07T15:14:22Z
Apple Weather App Experiencing Outage,2026-04-28T18:00:35Z
iOS 27 might add a lot more customization to the Camera app,2026-05-12T21:36:11Z
watchOS 26.5 Fixes Two Apple Watch Bugs,2026-05-05T14:56:33Z
Elon Musk and Sam Altman’s court battle over the future of OpenAI,2026-04-27T15:51:41Z
Apple Manufacturing Academy Hosts AI Showcase,2026-05-05T13:27:14Z
"Apple Card Holders Can Now Get Free AirPods Pro 3, But There's a Catch",2026-05-18T15:11:52Z
It’s time to let my iPhone Mini go,2026-05-05T23:53:08Z
Apple Card Promo to Offer Free AirPods Pro 3,2026-05-15T15:59:21Z
"Next Apple Watch Models Unlikely to Add Touch ID, Focus on Battery Life",2026-05-11T10:41:24Z
Google Confirms Gemini-Powered Siri Coming Later This Year,2026-04-22T18:08:04Z
"Ads Aren't in the Apple Maps App Yet, But They're Coming Soon",2026-05-13T23:15:42Z
Fortnite Returns to the App Store Worldwide as Epic Signals 'Final Battle' With Apple,2026-05-19T13:08:22Z
Discover Dropping Two Apple Wallet Features,2026-04-30T20:09:49Z
"Best Apple Deals of the Week: Low Prices on Apple Watch, MacBook Air, AirTag 1, and More",2026-04-24T16:49:58Z
"Apple Seeds watchOS 26.5, tvOS 26.5 and visionOS 26.5 Release Candidates",2026-05-04T17:19:29Z
"Apple, Intel Have Reached Preliminary Chip-Making Agreement",2026-05-08T18:00:00Z
"Apple Sports App Updated With 2026 World Cup Features, Expands to 90 More Countries",2026-05-19T17:26:03Z
Apple Has Given Up on the Vision Pro After M5 Refresh Flop,2026-04-29T18:31:59Z
Apple Alerted to macOS Security Vulnerability Uncovered With AI Tool,2026-05-14T16:04:59Z
Apple to Pay $250 Million to Settle Class Action Over Delayed Siri Features,2026-05-05T21:01:20Z
What to know as Trump visits Xi in China,2026-05-13T13:01:51Z
Apple Sued for Pulling Co-Viewing App Rave From the App Store,2026-05-07T17:41:50Z
Apple Releases iOS 26.4.2 and iPadOS 26.4.2 With Bug Fixes,2026-04-22T17:23:01Z
Sleep Number ComfortNext Lux Smart Bed: Redefining Support,2026-05-07T12:07:00Z
Apple Seeds Second iOS 26.5 and iPadOS 26.5 Release Candidates to Developers,2026-05-08T17:16:47Z
"Apple Looking to Samsung and Intel for Chips Amid Shortages, Report Says",2026-05-05T19:45:00Z
Apple TV Has Two Massive Hits Returning This Summer,2026-05-07T12:30:00Z
Vision Pro Creator Mike Rockwell Has Considered Leaving Apple,2026-04-22T13:09:58Z
WWDC 2026 is a Month Away: Apple Highlights 'Distinguished Winners',2026-05-07T14:35:06Z
Leaker: This Is Why Apple Is Delaying the iPhone 18,2026-05-06T14:56:56Z
Samsung Overtakes Apple for Top Smartphone Customer Satisfaction,2026-05-20T15:45:00Z
Apple Project Files Allegedly Stolen in Foxconn Ransomware Attack,2026-05-13T10:25:29Z
Are the $599 MacBook Neo's Days Numbered?,2026-05-07T18:17:37Z
Apple Reportedly Plans Major Camera AI Overhaul in iOS 27,2026-04-29T22:57:00Z
Leaker: Apple to Downgrade iPhone 18 in Two Ways,2026-04-22T15:02:54Z
Apple Wins EU Challenge Over Keyboard Maker's Citrus Logo,2026-05-06T18:48:36Z
Apple Seeds iOS 26.5 and iPadOS 26.5 Release Candidates to Developers,2026-05-04T17:12:07Z
Apple Eyes Intel and Samsung as Backup US Chipmakers,2026-05-05T09:32:48Z
Spotify to Adopt Apple's Technology for Video Podcasts,2026-05-14T16:02:53Z
Epic Games Wins Reversal of Stay in App Store Fee Legal Battle,2026-04-29T12:05:50Z
Apple's AI Smart Glasses Likely to Support Hand Gesture Controls,2026-04-29T20:23:48Z
Ads Are Coming to Apple Maps This Summer: Here's What to Expect,2026-04-24T20:58:00Z
Delta CEO Details Why He Thinks Amazon Leo Beats Starlink,2026-05-21T14:30:42Z
